{
  "name": "tokyo-night-day",
  "type": "light",
  "colors": {
    "editor.background": "#e6e7ed",
    "editor.foreground": "#343b59"
  },
  "tokenColors": [
    {
      "name": "Italics - Comments, Storage, Keyword Flow, Vue attributes, Decorators",
      "scope": [
        "comment",
        "meta.var.expr storage.type",
        "keyword.control.flow",
        "keyword.control.return",
        "meta.directive.vue punctuation.separator.key-value.html",
        "meta.directive.vue entity.other.attribute-name.html",
        "tag.decorator.js entity.name.tag.js",
        "tag.decorator.js punctuation.definition.tag.js",
        "storage.modifier",
        "string.quoted.docstring.multi",
        "string.quoted.docstring.multi.python punctuation.definition.string.begin",
        "string.quoted.docstring.multi.python punctuation.definition.string.end",
        "string.quoted.docstring.multi.python constant.character.escape"
      ],
      "settings": {
        "fontStyle": "italic"
      }
    },
    {
      "name": "Fix YAML block scalar, Python Logical",
      "scope": [
        "keyword.control.flow.block-scalar.literal",
        "keyword.control.flow.python"
      ],
      "settings": {
        "fontStyle": ""
      }
    },
    {
      "name": "Comment",
      "scope": [
        "comment",
        "comment.block.documentation",
        "punctuation.definition.comment",
        "comment.block.documentation punctuation",
        "string.quoted.docstring.multi",
        "string.quoted.docstring.multi.python punctuation.definition.string.begin",
        "string.quoted.docstring.multi.python punctuation.definition.string.end",
        "string.quoted.docstring.multi.python constant.character.escape"
      ],
      "settings": {
        "foreground": "#888b94"
      }
    },
    {
      "name": "Comment Doc",
      "scope": [
        "keyword.operator.assignment.jsdoc",
        "comment.block.documentation variable",
        "comment.block.documentation storage",
        "comment.block.documentation keyword",
        "comment.block.documentation support",
        "comment.block.documentation markup",
        "comment.block.documentation markup.inline.raw.string.markdown",
        "meta.other.type.phpdoc.php keyword.other.type.php",
        "meta.other.type.phpdoc.php support.other.namespace.php",
        "meta.other.type.phpdoc.php punctuation.separator.inheritance.php",
        "meta.other.type.phpdoc.php support.class",
        "keyword.other.phpdoc.php",
        "log.date"
      ],
      "settings": {
        "foreground": "#6c6e75"
      }
    },
    {
      "name": "Comment Doc Emphasized",
      "scope": [
        "meta.other.type.phpdoc.php support.class",
        "comment.block.documentation storage.type",
        "comment.block.documentation punctuation.definition.block.tag",
        "comment.block.documentation entity.name.type.instance"
      ],
      "settings": {
        "foreground": "#606269"
      }
    },
    {
      "name": "Number, Boolean, Undefined, Null",
      "scope": [
        "variable.other.constant",
        "punctuation.definition.constant",
        "constant.language",
        "constant.numeric",
        "support.constant",
        "constant.other.caps"
      ],
      "settings": {
        "foreground": "#965027"
      }
    },
    {
      "name": "String, Symbols",
      "scope": [
        "string",
        "constant.other.symbol",
        "constant.other.key",
        "meta.attribute-selector",
        "string constant.character"
      ],
      "settings": {
        "fontStyle": "",
        "foreground": "#385f0d"
      }
    },
    {
      "name": "Colors",
      "scope": [
        "constant.other.color",
        "constant.other.color.rgb-value.hex punctuation.definition.constant"
      ],
      "settings": {
        "foreground": "#40434f"
      }
    },
    {
      "name": "Invalid",
      "scope": [
        "invalid",
        "invalid.illegal"
      ],
      "settings": {
        "foreground": "#942f2f"
      }
    },
    {
      "name": "Invalid deprecated",
      "scope": "invalid.deprecated",
      "settings": {
        "foreground": "#65359d"
      }
    },
    {
      "name": "Storage Type",
      "scope": "storage.type",
      "settings": {
        "foreground": "#65359d"
      }
    },
    {
      "name": "Storage - modifier, var, const, let",
      "scope": [
        "meta.var.expr storage.type",
        "storage.modifier"
      ],
      "settings": {
        "foreground": "#7b43ba"
      }
    },
    {
      "name": "Interpolation / PHP tags / Smarty tags",
      "scope": [
        "punctuation.definition.template-expression",
        "punctuation.section.embedded",
        "meta.embedded.line.tag.smarty",
        "support.constant.handlebars",
        "punctuation.section.tag.twig"
      ],
      "settings": {
        "foreground": "#0f4b6e"
      }
    },
    {
      "name": "Blade, Twig, Smarty Handlebars keywords",
      "scope": [
        "keyword.control.smarty",
        "keyword.control.twig",
        "support.constant.handlebars keyword.control",
        "keyword.operator.comparison.twig",
        "keyword.blade",
        "entity.name.function.blade",
        "meta.tag.blade keyword.other.type.php"
      ],
      "settings": {
        "foreground": "#006c86"
      }
    },
    {
      "name": "Spread",
      "scope": [
        "keyword.operator.spread",
        "keyword.operator.rest"
      ],
      "settings": {
        "foreground": "#8c4351",
        "fontStyle": "bold"
      }
    },
    {
      "name": "Operator, Misc",
      "scope": [
        "keyword.operator",
        "keyword.control.as",
        "keyword.other",
        "keyword.operator.bitwise.shift",
        "punctuation",
        "expression.embbeded.vue punctuation.definition.tag",
        "text.html.twig meta.tag.inline.any.html",
        "meta.tag.template.value.twig meta.function.arguments.twig",
        "meta.directive.vue punctuation.separator.key-value.html",
        "punctuation.definition.constant.markdown",
        "punctuation.definition.string",
        "punctuation.support.type.property-name",
        "text.html.vue-html meta.tag",
        "meta.attribute.directive",
        "punctuation.definition.keyword",
        "punctuation.terminator.rule",
        "punctuation.definition.entity",
        "punctuation.separator.inheritance.php",
        "keyword.other.template",
        "keyword.other.substitution",
        "entity.name.operator",
        "meta.property-list punctuation.separator.key-value",
        "meta.at-rule.mixin punctuation.separator.key-value",
        "meta.at-rule.function variable.parameter.url",
        "meta.embedded.inline.phpx punctuation.definition.tag.begin.html",
        "meta.embedded.inline.phpx punctuation.definition.tag.end.html"
      ],
      "settings": {
        "foreground": "#006C86"
      }
    },
    {
      "name": "Import, Export, From, Default",
      "scope": [
        "keyword.control.module.js",
        "keyword.control.import",
        "keyword.control.export",
        "keyword.control.from",
        "keyword.control.default",
        "meta.import keyword.other"
      ],
      "settings": {
        "foreground": "#0f4b6e"
      }
    },
    {
      "name": "Keyword",
      "scope": [
        "keyword",
        "keyword.control",
        "keyword.other.important"
      ],
      "settings": {
        "foreground": "#65359d"
      }
    },
    {
      "name": "Keyword SQL",
      "scope": "keyword.other.DML",
      "settings": {
        "foreground": "#0f4b6e"
      }
    },
    {
      "name": "Keyword Operator Logical, Arrow, Ternary, Comparison",
      "scope": [
        "keyword.operator.logical",
        "storage.type.function",
        "keyword.operator.bitwise",
        "keyword.operator.ternary",
        "keyword.operator.comparison",
        "keyword.operator.relational",
        "keyword.operator.or.regexp"
      ],
      "settings": {
        "foreground": "#65359d"
      }
    },
    {
      "name": "Tag",
      "scope": "entity.name.tag",
      "settings": {
        "foreground": "#8c4351"
      }
    },
    {
      "name": "Tag - Custom / Unrecognized",
      "scope": [
        "entity.name.tag support.class.component",
        "meta.tag.custom entity.name.tag",
        "meta.tag.other.unrecognized.html.derivative entity.name.tag",
        "meta.tag"
      ],
      "settings": {
        "foreground": "#69323d"
      }
    },
    {
      "name": "Tag Punctuation",
      "scope": [
        "punctuation.definition.tag",
        "text.html.php meta.embedded.block.html meta.tag.metadata.script.end.html punctuation.definition.tag.begin.html text.html.basic"
      ],
      "settings": {
        "foreground": "#b05467"
      }
    },
    {
      "name": "Tag Punctuation - Custom",
      "scope": [
        "meta.tag.custom punctuation.definition.tag",
        "meta.jsx punctuation.definition.tag"
      ],
      "settings": {
        "foreground": "#69323d"
      }
    },
    {
      "name": "Globals, PHP Constants, etc",
      "scope": [
        "constant.other.php",
        "variable.other.global.safer",
        "variable.other.global.safer punctuation.definition.variable",
        "variable.other.global",
        "variable.other.global punctuation.definition.variable",
        "constant.other.haskell"
      ],
      "settings": {
        "foreground": "#8f5e15"
      }
    },
    {
      "name": "Variables",
      "scope": [
        "variable",
        "support.variable",
        "string constant.other.placeholder",
        "variable.parameter.handlebars",
        "variable.other.object",
        "meta.fstring",
        "meta.function-call meta.function-call.arguments",
        "meta.embedded.inline.phpx constant.other.php"
      ],
      "settings": {
        "foreground": "#343b58"
      }
    },
    {
      "name": "Variable Array Key",
      "scope": "meta.array.literal variable",
      "settings": {
        "foreground": "#0f4b6e"